{
  "$schema": "https://json-schema.org/draft/2020-12/schema",
  "type": "object",
  "properties": {
    "$schema": {
      "type": "string"
    },
    "schemaVersion": {
      "type": "number",
      "const": 1
    },
    "asset": {
      "type": "string",
      "minLength": 1
    },
    "assetHash": {
      "type": "string",
      "pattern": "^sha256:[0-9a-f]{64}$"
    },
    "provider": {
      "type": "string",
      "minLength": 1
    },
    "model": {
      "type": "string",
      "minLength": 1
    },
    "language": {
      "type": "string"
    },
    "words": {
      "type": "array",
      "items": {
        "type": "object",
        "properties": {
          "id": {
            "type": "string",
            "pattern": "^w_\\d{6,}$"
          },
          "text": {
            "type": "string"
          },
          "start": {
            "type": "number",
            "minimum": 0
          },
          "end": {
            "type": "number",
            "minimum": 0
          },
          "confidence": {
            "type": "number",
            "minimum": 0,
            "maximum": 1
          },
          "speechInside": {
            "type": "boolean"
          },
          "speaker": {
            "type": "string",
            "pattern": "^s\\d+$"
          }
        },
        "required": [
          "id",
          "text",
          "start",
          "end"
        ],
        "additionalProperties": false
      }
    },
    "edits": {
      "default": {},
      "type": "object",
      "propertyNames": {
        "type": "string",
        "pattern": "^w_\\d{6,}$"
      },
      "additionalProperties": {
        "type": "object",
        "properties": {
          "text": {
            "type": "string"
          },
          "speaker": {
            "type": "string",
            "pattern": "^s\\d+$"
          }
        },
        "additionalProperties": false
      }
    },
    "nextWordId": {
      "type": "integer",
      "exclusiveMinimum": 0,
      "maximum": 9007199254740991
    },
    "speakers": {
      "type": "array",
      "items": {
        "type": "object",
        "properties": {
          "id": {
            "type": "string",
            "pattern": "^s\\d+$"
          },
          "name": {
            "type": "string",
            "minLength": 1
          }
        },
        "required": [
          "id",
          "name"
        ],
        "additionalProperties": false
      }
    },
    "nextSpeakerId": {
      "type": "integer",
      "exclusiveMinimum": 0,
      "maximum": 9007199254740991
    }
  },
  "required": [
    "schemaVersion",
    "asset",
    "assetHash",
    "provider",
    "model",
    "words"
  ],
  "additionalProperties": false,
  "$id": "https://frameshell.dev/schema/v1/transcript.json"
}
